<?xml version="1.0" encoding="UTF-8" standalone="no"?>
<widget xmlns="http://samsung.widgetsdk.uievolution.com" xmlns:xsi="http://www.w3.org/2001/XMLSchema-instance" name="WidgetSamsung_OitoRainhas" xsi:schemaLocation="http://samsung.widgetsdk.uievolution.com .settings/projectConfig.xsd ">
    <description/>
    <version>1.0</version>
    <width>320</width>
    <height>460</height>
    <icon>icon.png</icon>
    <main>index.html</main>
    <network>false</network>
    <defaultMode>fullscreen</defaultMode>
</widget>
